{
  "version": "1.0.0",
  "timeline_id": "b4c1f3bb-ae7c-49c5-aa61-4641dce12cfe",
  "source_media": {
    "id": "fff55909-6d06-4024-b21b-ed75c98096f8",
    "uri": "C:\\HARSHINI\\PLACEMENT\\incubrix\\test_pack\\assets\\interview.mp4",
    "duration_ms": 225000,
    "fps": 30.0,
    "width": 1280,
    "height": 720,
    "audio_channels": 1,
    "audio_sample_rate": 44100,
    "sha256": "9ff80ed37e9fffb52ad80052440952262b076088d6b03d899e62017e785af73d"
  },
  "segments": [
    {
      "id": "558dbb68-b259-4811-a0c1-fa2c8ab86062",
      "source_id": "fff55909-6d06-4024-b21b-ed75c98096f8",
      "source_start_ms": 0,
      "source_end_ms": 62000,
      "speed": 1.0,
      "volume": 1.0,
      "muted": false,
      "tags": []
    },
    {
      "id": "4ad6759f-b3a2-41eb-99ad-aa12b1751b0b",
      "source_id": "fff55909-6d06-4024-b21b-ed75c98096f8",
      "source_start_ms": 71000,
      "source_end_ms": 225000,
      "speed": 1.0,
      "volume": 1.0,
      "muted": false,
      "tags": []
    }
  ],
  "captions": [],
  "audio_effects": [],
  "background_audio": [],
  "history_index": 0,
  "timeline_hash": "a579c8785249a02048a627bebeca635c45db7878f90011fcdf11f108c02e5ea9",
  "duration_ms": 216000
}