{
  "version": "1.0.0",
  "timeline_id": "7c8ba2a9-d345-465d-9372-f69de7dece7f",
  "source_media": {
    "id": "9012651b-2d11-4da4-a8d6-c0e67a983b07",
    "uri": "C:\\HARSHINI\\PLACEMENT\\video-engine\\test_pack\\assets\\interview.mp4",
    "duration_ms": 225000,
    "fps": 30.0,
    "width": 1280,
    "height": 720,
    "audio_channels": 1,
    "audio_sample_rate": 44100,
    "sha256": "9ff80ed37e9fffb52ad80052440952262b076088d6b03d899e62017e785af73d"
  },
  "segments": [
    {
      "id": "c6a2c22b-7548-4e97-a861-a0f97bd3f290",
      "source_id": "9012651b-2d11-4da4-a8d6-c0e67a983b07",
      "source_start_ms": 0,
      "source_end_ms": 20000,
      "speed": 1.0,
      "volume": 1.0,
      "muted": false,
      "tags": []
    },
    {
      "id": "8502189b-3937-406c-a737-288ca5af34b0",
      "source_id": "9012651b-2d11-4da4-a8d6-c0e67a983b07",
      "source_start_ms": 30000,
      "source_end_ms": 225000,
      "speed": 1.0,
      "volume": 1.0,
      "muted": false,
      "tags": []
    }
  ],
  "captions": [],
  "audio_effects": [],
  "background_audio": [],
  "history_index": 0,
  "timeline_hash": "726759b9deb5c7ef9d41abd027db144a749a951b432e2e4a49e0a91d51e97d83",
  "duration_ms": 215000
}