{
  "version": "1.0.0",
  "timeline_id": "e85c40e6-b591-491e-bab8-2c60107f98d3",
  "source_media": {
    "id": "09227f7f-9047-4091-ae5c-59a8085fa5e7",
    "uri": "C:\\HARSHINI\\PLACEMENT\\incubrix\\test_pack\\assets\\interview.mp4",
    "duration_ms": 225000,
    "fps": 30.0,
    "width": 1280,
    "height": 720,
    "audio_channels": 1,
    "audio_sample_rate": 44100,
    "sha256": "9ff80ed37e9fffb52ad80052440952262b076088d6b03d899e62017e785af73d"
  },
  "segments": [
    {
      "id": "3c3ea3ad-ae4c-4e9b-9a7a-bcf2ec91660d",
      "source_id": "09227f7f-9047-4091-ae5c-59a8085fa5e7",
      "source_start_ms": 0,
      "source_end_ms": 225000,
      "speed": 1.0,
      "volume": 1.0,
      "muted": false,
      "tags": []
    }
  ],
  "captions": [
    {
      "id": "6a25333a-78a4-433c-a185-5c3df316121f",
      "source_start_ms": 42000,
      "source_end_ms": 44000,
      "word_ids": [
        "w_13",
        "w_14",
        "w_15",
        "w_16"
      ],
      "text": "Hello World",
      "style": {
        "color": "white",
        "font_size": 24,
        "position": "bottom",
        "background": "black@0.5"
      },
      "status": "active"
    }
  ],
  "audio_effects": [],
  "background_audio": [],
  "history_index": 0,
  "timeline_hash": "49b35395ff3251c61d265af768218285828f665fd94faeee3113841c399a5215",
  "duration_ms": 225000
}