{
  "version": "1.0.0",
  "timeline_id": "0d00e338-601d-4d0d-90a7-806c120a3a28",
  "source_media": {
    "id": "930cf2a9-4e56-4161-b75c-e9640bbda609",
    "uri": "test_pack/assets/interview.mp4",
    "duration_ms": 225000,
    "fps": 30.0,
    "width": 1280,
    "height": 720,
    "audio_channels": 1,
    "audio_sample_rate": 44100,
    "sha256": "9ff80ed37e9fffb52ad80052440952262b076088d6b03d899e62017e785af73d"
  },
  "segments": [
    {
      "id": "538b1962-6fad-40ac-905e-2b0055b4fa30",
      "source_id": "930cf2a9-4e56-4161-b75c-e9640bbda609",
      "source_start_ms": 0,
      "source_end_ms": 10000,
      "speed": 1.0,
      "volume": 1.0,
      "muted": false,
      "tags": []
    },
    {
      "id": "40afa824-90cf-42cf-bf3d-f17308d28fdc",
      "source_id": "930cf2a9-4e56-4161-b75c-e9640bbda609",
      "source_start_ms": 10000,
      "source_end_ms": 30000,
      "speed": 4.0,
      "volume": 1.0,
      "muted": false,
      "tags": []
    },
    {
      "id": "aae85a80-e4fe-418f-8f28-9174eaae5768",
      "source_id": "930cf2a9-4e56-4161-b75c-e9640bbda609",
      "source_start_ms": 30000,
      "source_end_ms": 225000,
      "speed": 1.0,
      "volume": 1.0,
      "muted": false,
      "tags": []
    }
  ],
  "captions": [],
  "audio_effects": [],
  "background_audio": [],
  "history_index": 0,
  "timeline_hash": "016152de5d2d6556622bb6dc555a931da3d26ff3087700617b82aed244a40f7a",
  "duration_ms": 210000
}