{
  "version": "1.0.0",
  "timeline_id": "4ba2b652-7420-4126-9176-d6b2d5685509",
  "source_media": {
    "id": "9a74c363-ef80-4286-9f8e-19bdfa97a34b",
    "uri": "test_pack/assets/interview.mp4",
    "duration_ms": 225000,
    "fps": 30.0,
    "width": 1280,
    "height": 720,
    "audio_channels": 1,
    "audio_sample_rate": 44100,
    "sha256": "9ff80ed37e9fffb52ad80052440952262b076088d6b03d899e62017e785af73d"
  },
  "segments": [
    {
      "id": "71dfc4ee-ad46-4d65-948c-1d097e463488",
      "source_id": "9a74c363-ef80-4286-9f8e-19bdfa97a34b",
      "source_start_ms": 10000,
      "source_end_ms": 20000,
      "speed": 1.0,
      "volume": 1.0,
      "muted": false,
      "tags": []
    },
    {
      "id": "9236f428-b509-4a1c-a475-3861ed27b93c",
      "source_id": "9a74c363-ef80-4286-9f8e-19bdfa97a34b",
      "source_start_ms": 30000,
      "source_end_ms": 215000,
      "speed": 1.0,
      "volume": 1.0,
      "muted": false,
      "tags": []
    }
  ],
  "captions": [],
  "audio_effects": [],
  "background_audio": [],
  "history_index": 0,
  "timeline_hash": "309f83927a61706227a2bba4263745a0ed94e00beffbab6f2e587ef280ea44ce",
  "duration_ms": 195000
}