{
  "version": "1.0.0",
  "timeline_id": "ad146438-d11f-4cad-9b22-27ab20c63668",
  "source_media": {
    "id": "acdb5863-ee4f-497e-b5e4-ff6c4ffd7a0f",
    "uri": "C:\\HARSHINI\\PLACEMENT\\incubrix\\test_pack\\assets\\interview.mp4",
    "duration_ms": 225000,
    "fps": 30.0,
    "width": 1280,
    "height": 720,
    "audio_channels": 1,
    "audio_sample_rate": 44100,
    "sha256": "9ff80ed37e9fffb52ad80052440952262b076088d6b03d899e62017e785af73d"
  },
  "segments": [
    {
      "id": "8007b92a-ab82-47a4-b8aa-deb4aa435d77",
      "source_id": "acdb5863-ee4f-497e-b5e4-ff6c4ffd7a0f",
      "source_start_ms": 80000,
      "source_end_ms": 225000,
      "speed": 1.0,
      "volume": 1.0,
      "muted": false,
      "tags": []
    }
  ],
  "captions": [],
  "audio_effects": [],
  "background_audio": [],
  "history_index": 0,
  "timeline_hash": "be07d1e771ffa5c3af2422481be912e5c900e940a226ce5e590ace4edd7bcfad",
  "duration_ms": 145000
}