{
  "version": "1.0.0",
  "timeline_id": "f4ba40ec-be64-4f68-bec1-07caf14e7005",
  "source_media": {
    "id": "f21efdc4-7581-4506-8c44-ecbdb68e2ec7",
    "uri": "C:\\HARSHINI\\PLACEMENT\\incubrix\\test_pack\\assets\\interview.mp4",
    "duration_ms": 225000,
    "fps": 30.0,
    "width": 1280,
    "height": 720,
    "audio_channels": 1,
    "audio_sample_rate": 44100,
    "sha256": "9ff80ed37e9fffb52ad80052440952262b076088d6b03d899e62017e785af73d"
  },
  "segments": [
    {
      "id": "9b5625e8-242e-4c2b-b078-0f8d3a72f22f",
      "source_id": "f21efdc4-7581-4506-8c44-ecbdb68e2ec7",
      "source_start_ms": 0,
      "source_end_ms": 225000,
      "speed": 1.0,
      "volume": 1.0,
      "muted": false,
      "tags": []
    }
  ],
  "captions": [
    {
      "id": "48d30585-e70e-4dfc-b248-ff8dfb2db577",
      "source_start_ms": 42000,
      "source_end_ms": 44000,
      "word_ids": [
        "w_13",
        "w_14",
        "w_15",
        "w_16"
      ],
      "text": "Welcome!",
      "style": {
        "color": "white",
        "font_size": 24,
        "position": "bottom",
        "background": "black@0.5"
      },
      "status": "active"
    }
  ],
  "audio_effects": [],
  "background_audio": [],
  "history_index": 0,
  "timeline_hash": "45037c1a60df8ccdcc5e1e7c56bee1b986cffb54c964247703e2358309ef418f",
  "duration_ms": 225000
}