{
  "version": "1.0.0",
  "timeline_id": "f6503146-a9cb-4305-8fb5-cc55217ebc55",
  "source_media": {
    "id": "ff8f9d7e-5f3a-446b-aac7-bea9c37296b3",
    "uri": "C:\\HARSHINI\\PLACEMENT\\video-engine\\test_pack\\assets\\multispeaker.mp4",
    "duration_ms": 150000,
    "fps": 30.0,
    "width": 1280,
    "height": 720,
    "audio_channels": 1,
    "audio_sample_rate": 44100,
    "sha256": "b9af2281104a98cf199159e7e7b62ad6849d9f8b3965f5750dcddde6a5facd0e"
  },
  "segments": [
    {
      "id": "8ba2da93-5e97-4059-8060-d48f34023237",
      "source_id": "ff8f9d7e-5f3a-446b-aac7-bea9c37296b3",
      "source_start_ms": 10000,
      "source_end_ms": 150000,
      "speed": 1.0,
      "volume": 1.0,
      "muted": false,
      "tags": []
    }
  ],
  "captions": [],
  "audio_effects": [],
  "background_audio": [],
  "history_index": 0,
  "timeline_hash": "d187ecb0cb8b907372b605ebba1146f78a823eec3c3134da991513fe634645e8",
  "duration_ms": 140000
}