{
  "version": "1.0.0",
  "timeline_id": "b65f3c8c-9ac2-4f66-9889-c80c64e58ec2",
  "source_media": {
    "id": "b8f3fb8f-3a2b-445c-9726-b606fa52e517",
    "uri": "C:\\HARSHINI\\PLACEMENT\\video-engine\\test_pack\\assets\\interview.mp4",
    "duration_ms": 225000,
    "fps": 30.0,
    "width": 1280,
    "height": 720,
    "audio_channels": 1,
    "audio_sample_rate": 44100,
    "sha256": "9ff80ed37e9fffb52ad80052440952262b076088d6b03d899e62017e785af73d"
  },
  "segments": [
    {
      "id": "41338c09-6e88-44b2-98b4-c6869c7dedd2",
      "source_id": "b8f3fb8f-3a2b-445c-9726-b606fa52e517",
      "source_start_ms": 0,
      "source_end_ms": 225000,
      "speed": 1.0,
      "volume": 1.0,
      "muted": false,
      "tags": []
    }
  ],
  "captions": [],
  "audio_effects": [],
  "background_audio": [],
  "history_index": 0,
  "timeline_hash": "0ea6f2ce8ec8c47f0834dd6ff1da8c822e5b193e03db83caf21366925b67c9c5",
  "duration_ms": 225000
}