{
  "version": "1.0.0",
  "timeline_id": "5ef7dfb1-c685-4e65-86d5-0014d7c951ef",
  "source_media": {
    "id": "d3be590c-c19f-4f0d-b5ac-a9ddee7b7709",
    "uri": "test_pack/assets/short_test.mp4",
    "duration_ms": 10000,
    "fps": 30.0,
    "width": 1280,
    "height": 720,
    "audio_channels": 1,
    "audio_sample_rate": 44100,
    "sha256": "233d8ef468450913cf8819d61735f1e999103f52d5e670bc433f78ef774fd1c2"
  },
  "segments": [
    {
      "id": "6feaf8ab-0dab-4a60-9206-bb644c0e3a71",
      "source_id": "d3be590c-c19f-4f0d-b5ac-a9ddee7b7709",
      "source_start_ms": 2000,
      "source_end_ms": 10000,
      "speed": 1.0,
      "volume": 1.0,
      "muted": false,
      "tags": []
    }
  ],
  "captions": [],
  "audio_effects": [],
  "background_audio": [],
  "history_index": 0,
  "timeline_hash": "1a315a4132fb94972dec5955965275271aee140bbb005c11d3b6097815352190",
  "duration_ms": 8000
}