{
  "version": "1.0.0",
  "timeline_id": "de3cb56f-2827-4e04-9f97-d246dfc97700",
  "source_media": {
    "id": "4df874b5-32da-48b1-8822-047b74b9d4d8",
    "uri": "C:\\HARSHINI\\PLACEMENT\\incubrix\\test_pack\\assets\\multispeaker.mp4",
    "duration_ms": 150000,
    "fps": 30.0,
    "width": 1280,
    "height": 720,
    "audio_channels": 1,
    "audio_sample_rate": 44100,
    "sha256": "b9af2281104a98cf199159e7e7b62ad6849d9f8b3965f5750dcddde6a5facd0e"
  },
  "segments": [
    {
      "id": "5df94306-7d7e-4ee2-8aab-c563cb499087",
      "source_id": "4df874b5-32da-48b1-8822-047b74b9d4d8",
      "source_start_ms": 10000,
      "source_end_ms": 150000,
      "speed": 1.0,
      "volume": 1.0,
      "muted": false,
      "tags": []
    }
  ],
  "captions": [],
  "audio_effects": [],
  "background_audio": [],
  "history_index": 0,
  "timeline_hash": "0869fd4a453f4da4ad7340f7d491b7fdc803181271a45d7df943d9bbf6753d7a",
  "duration_ms": 140000
}