{
  "version": "1.0.0",
  "timeline_id": "4faac08c-df3a-4034-97d6-4cf927819ce6",
  "source_media": {
    "id": "dd4f2a3f-4d99-4380-9a8a-950b62827533",
    "uri": "C:\\HARSHINI\\PLACEMENT\\incubrix\\test_pack\\assets\\interview.mp4",
    "duration_ms": 225000,
    "fps": 30.0,
    "width": 1280,
    "height": 720,
    "audio_channels": 1,
    "audio_sample_rate": 44100,
    "sha256": "9ff80ed37e9fffb52ad80052440952262b076088d6b03d899e62017e785af73d"
  },
  "segments": [
    {
      "id": "6702603c-c3f1-450b-8125-8c85f605aeef",
      "source_id": "dd4f2a3f-4d99-4380-9a8a-950b62827533",
      "source_start_ms": 0,
      "source_end_ms": 225000,
      "speed": 1.0,
      "volume": 1.0,
      "muted": false,
      "tags": []
    }
  ],
  "captions": [],
  "audio_effects": [],
  "background_audio": [],
  "history_index": 0,
  "timeline_hash": "9f4849d058d1ccbca7ca3733582d8d35ea301faedc79374f019bf0cc09d33098",
  "duration_ms": 225000
}