{
  "version": "1.0.0",
  "timeline_id": "fe923d66-b17e-4ff5-adf3-921e5dc27432",
  "source_media": {
    "id": "44187ec2-e64f-415f-a144-98ab3420dc47",
    "uri": "C:\\HARSHINI\\PLACEMENT\\incubrix\\test_pack\\assets\\interview.mp4",
    "duration_ms": 225000,
    "fps": 30.0,
    "width": 1280,
    "height": 720,
    "audio_channels": 1,
    "audio_sample_rate": 44100,
    "sha256": "9ff80ed37e9fffb52ad80052440952262b076088d6b03d899e62017e785af73d"
  },
  "segments": [
    {
      "id": "4cd0ebfa-fab0-4d55-93e9-f3158f85b839",
      "source_id": "44187ec2-e64f-415f-a144-98ab3420dc47",
      "source_start_ms": 0,
      "source_end_ms": 10000,
      "speed": 1.0,
      "volume": 1.0,
      "muted": false,
      "tags": []
    },
    {
      "id": "dee6ae32-b66f-43b8-9e51-60977b665c2f",
      "source_id": "44187ec2-e64f-415f-a144-98ab3420dc47",
      "source_start_ms": 10000,
      "source_end_ms": 20000,
      "speed": 0.5,
      "volume": 1.0,
      "muted": false,
      "tags": []
    },
    {
      "id": "717d66ed-9453-4293-a633-ade679248e89",
      "source_id": "44187ec2-e64f-415f-a144-98ab3420dc47",
      "source_start_ms": 20000,
      "source_end_ms": 225000,
      "speed": 1.0,
      "volume": 1.0,
      "muted": false,
      "tags": []
    }
  ],
  "captions": [],
  "audio_effects": [],
  "background_audio": [],
  "history_index": 0,
  "timeline_hash": "b870ef07f6207b6be979581d44ae624a997fec2474906721627a9274d929baa0",
  "duration_ms": 235000
}