{
  "version": "1.0.0",
  "timeline_id": "71402b28-8b89-49b6-b9eb-33325882390b",
  "source_media": {
    "id": "0b34df07-be74-4f5d-824a-fac70e676514",
    "uri": "test_pack/assets/interview.mp4",
    "duration_ms": 225000,
    "fps": 30.0,
    "width": 1280,
    "height": 720,
    "audio_channels": 1,
    "audio_sample_rate": 44100,
    "sha256": "9ff80ed37e9fffb52ad80052440952262b076088d6b03d899e62017e785af73d"
  },
  "segments": [
    {
      "id": "7564b445-6b96-4a86-a9f8-b069f3344cb3",
      "source_id": "0b34df07-be74-4f5d-824a-fac70e676514",
      "source_start_ms": 0,
      "source_end_ms": 8500,
      "speed": 1.0,
      "volume": 1.0,
      "muted": false,
      "tags": []
    },
    {
      "id": "9dd16835-1b80-4af5-b914-7f58dacb6358",
      "source_id": "0b34df07-be74-4f5d-824a-fac70e676514",
      "source_start_ms": 9000,
      "source_end_ms": 225000,
      "speed": 1.0,
      "volume": 1.0,
      "muted": false,
      "tags": []
    }
  ],
  "captions": [],
  "audio_effects": [],
  "background_audio": [],
  "history_index": 0,
  "timeline_hash": "42ef23f91f184d4524114180570bfce2177ba654c31c1cd55022aa5d9d19c0c3",
  "duration_ms": 224500
}