{
  "version": "1.0.0",
  "timeline_id": "c5b2c5fe-eebf-457f-80bc-0d12c84733f3",
  "source_media": {
    "id": "fb719104-ee8a-4a13-bcb4-27975683529b",
    "uri": "test_pack/assets/interview.mp4",
    "duration_ms": 225000,
    "fps": 30.0,
    "width": 1280,
    "height": 720,
    "audio_channels": 1,
    "audio_sample_rate": 44100,
    "sha256": "9ff80ed37e9fffb52ad80052440952262b076088d6b03d899e62017e785af73d"
  },
  "segments": [
    {
      "id": "27ac5864-e4d2-41ae-9de5-4654507bb495",
      "source_id": "fb719104-ee8a-4a13-bcb4-27975683529b",
      "source_start_ms": 5000,
      "source_end_ms": 225000,
      "speed": 1.0,
      "volume": 1.0,
      "muted": false,
      "tags": []
    }
  ],
  "captions": [],
  "audio_effects": [],
  "background_audio": [],
  "history_index": 0,
  "timeline_hash": "3685e2713f6112a856d774479e40dd782dee92fe45d27ea7d5c8b5b0ee995184",
  "duration_ms": 220000
}