{
  "version": "1.0.0",
  "timeline_id": "3d80f7e6-853e-4c05-ae6e-8da660365753",
  "source_media": {
    "id": "fd51325d-b3ed-43ad-9e56-b007fe3f19d5",
    "uri": "test_pack/assets/interview.mp4",
    "duration_ms": 225000,
    "fps": 30.0,
    "width": 1280,
    "height": 720,
    "audio_channels": 1,
    "audio_sample_rate": 44100,
    "sha256": "9ff80ed37e9fffb52ad80052440952262b076088d6b03d899e62017e785af73d"
  },
  "segments": [
    {
      "id": "6182c3c1-814d-4c03-9a7f-66f27080bb36",
      "source_id": "fd51325d-b3ed-43ad-9e56-b007fe3f19d5",
      "source_start_ms": 0,
      "source_end_ms": 10000,
      "speed": 1.0,
      "volume": 1.0,
      "muted": false,
      "tags": []
    },
    {
      "id": "b356c119-9d9c-4e32-877d-ee1a36694ba9",
      "source_id": "fd51325d-b3ed-43ad-9e56-b007fe3f19d5",
      "source_start_ms": 10000,
      "source_end_ms": 20000,
      "speed": 0.5,
      "volume": 1.0,
      "muted": false,
      "tags": []
    },
    {
      "id": "039ac84f-5c90-4345-b02c-8cf92fce4ec2",
      "source_id": "fd51325d-b3ed-43ad-9e56-b007fe3f19d5",
      "source_start_ms": 20000,
      "source_end_ms": 225000,
      "speed": 1.0,
      "volume": 1.0,
      "muted": false,
      "tags": []
    }
  ],
  "captions": [],
  "audio_effects": [],
  "background_audio": [],
  "history_index": 0,
  "timeline_hash": "d6c9e70cd8dfe7f8ec64b992e96a323c72977af9a91c31337c2bef578729e80b",
  "duration_ms": 235000
}