{
  "version": "1.0.0",
  "timeline_id": "75be8087-8736-4b3b-8e13-3cba852e2a5e",
  "source_media": {
    "id": "19980428-248e-425e-a7cc-1a9dac7d8194",
    "uri": "test_pack/assets/interview.mp4",
    "duration_ms": 225000,
    "fps": 30.0,
    "width": 1280,
    "height": 720,
    "audio_channels": 1,
    "audio_sample_rate": 44100,
    "sha256": "9ff80ed37e9fffb52ad80052440952262b076088d6b03d899e62017e785af73d"
  },
  "segments": [
    {
      "id": "80e71149-4a13-47b2-948c-e04991845ede",
      "source_id": "19980428-248e-425e-a7cc-1a9dac7d8194",
      "source_start_ms": 0,
      "source_end_ms": 225000,
      "speed": 1.0,
      "volume": 1.0,
      "muted": false,
      "tags": []
    }
  ],
  "captions": [],
  "audio_effects": [],
  "background_audio": [],
  "history_index": 0,
  "timeline_hash": "2e6423a896f942364bb7e18d09011dc1287d4b6fbe4a6928700d7fbc7d6cab75",
  "duration_ms": 225000
}