{
  "version": "1.0.0",
  "timeline_id": "0b31ae2a-0454-453d-bc49-00760dbe04db",
  "source_media": {
    "id": "abeffb9f-59c9-43c0-b941-3947e1a187f5",
    "uri": "test_pack/assets/interview.mp4",
    "duration_ms": 225000,
    "fps": 30.0,
    "width": 1280,
    "height": 720,
    "audio_channels": 1,
    "audio_sample_rate": 44100,
    "sha256": "9ff80ed37e9fffb52ad80052440952262b076088d6b03d899e62017e785af73d"
  },
  "segments": [
    {
      "id": "c44b46b5-04d3-4a90-a54d-df417e0261b1",
      "source_id": "abeffb9f-59c9-43c0-b941-3947e1a187f5",
      "source_start_ms": 0,
      "source_end_ms": 10000,
      "speed": 1.0,
      "volume": 1.0,
      "muted": false,
      "tags": []
    },
    {
      "id": "8b9d188d-2019-420d-b7ee-ce627e75da67",
      "source_id": "abeffb9f-59c9-43c0-b941-3947e1a187f5",
      "source_start_ms": 10000,
      "source_end_ms": 20000,
      "speed": 2.0,
      "volume": 1.0,
      "muted": false,
      "tags": []
    },
    {
      "id": "c2692a5b-a1ec-4734-bc9d-c57e8cd4a0b8",
      "source_id": "abeffb9f-59c9-43c0-b941-3947e1a187f5",
      "source_start_ms": 20000,
      "source_end_ms": 35000,
      "speed": 1.0,
      "volume": 1.0,
      "muted": false,
      "tags": []
    },
    {
      "id": "633d0091-5b5a-40b3-91d8-df8e7e3a2f4a",
      "source_id": "abeffb9f-59c9-43c0-b941-3947e1a187f5",
      "source_start_ms": 35000,
      "source_end_ms": 45000,
      "speed": 1.5,
      "volume": 1.0,
      "muted": false,
      "tags": []
    },
    {
      "id": "24780c4d-fa8b-4ea9-abae-4b16d86de2df",
      "source_id": "abeffb9f-59c9-43c0-b941-3947e1a187f5",
      "source_start_ms": 45000,
      "source_end_ms": 225000,
      "speed": 1.0,
      "volume": 1.0,
      "muted": false,
      "tags": []
    }
  ],
  "captions": [],
  "audio_effects": [],
  "background_audio": [],
  "history_index": 0,
  "timeline_hash": "2a96ebb12f2118a81975a87e2ce68a8671faea863cddad118d321ba6a0ecf7a8",
  "duration_ms": 216667
}