{
  "version": "1.0.0",
  "timeline_id": "f9838a13-1982-4e6c-b3f4-e46f2524918c",
  "source_media": {
    "id": "437bde5b-aa4f-4eba-aa18-ec735b12d7a3",
    "uri": "C:\\HARSHINI\\PLACEMENT\\incubrix\\test_pack\\assets\\interview.mp4",
    "duration_ms": 225000,
    "fps": 30.0,
    "width": 1280,
    "height": 720,
    "audio_channels": 1,
    "audio_sample_rate": 44100,
    "sha256": "9ff80ed37e9fffb52ad80052440952262b076088d6b03d899e62017e785af73d"
  },
  "segments": [
    {
      "id": "5da7a69c-0604-4980-a042-ef749f5868c9",
      "source_id": "437bde5b-aa4f-4eba-aa18-ec735b12d7a3",
      "source_start_ms": 0,
      "source_end_ms": 210000,
      "speed": 1.0,
      "volume": 1.0,
      "muted": false,
      "tags": []
    },
    {
      "id": "9edbde4c-1391-4e37-b62f-84e14a1a21bb",
      "source_id": "437bde5b-aa4f-4eba-aa18-ec735b12d7a3",
      "source_start_ms": 211000,
      "source_end_ms": 214500,
      "speed": 1.0,
      "volume": 1.0,
      "muted": false,
      "tags": []
    },
    {
      "id": "c53a5609-5c00-4ef7-b946-41ac09a35133",
      "source_id": "437bde5b-aa4f-4eba-aa18-ec735b12d7a3",
      "source_start_ms": 215500,
      "source_end_ms": 217500,
      "speed": 1.0,
      "volume": 1.0,
      "muted": false,
      "tags": []
    },
    {
      "id": "87b9bcf7-fece-4dbb-8c22-4558cf7ad7f0",
      "source_id": "437bde5b-aa4f-4eba-aa18-ec735b12d7a3",
      "source_start_ms": 218500,
      "source_end_ms": 220500,
      "speed": 1.0,
      "volume": 1.0,
      "muted": false,
      "tags": []
    },
    {
      "id": "b959cf59-eabd-41d3-a0f5-355e7b977ef5",
      "source_id": "437bde5b-aa4f-4eba-aa18-ec735b12d7a3",
      "source_start_ms": 221500,
      "source_end_ms": 225000,
      "speed": 1.0,
      "volume": 1.0,
      "muted": false,
      "tags": []
    }
  ],
  "captions": [],
  "audio_effects": [],
  "background_audio": [],
  "history_index": 0,
  "timeline_hash": "15078bf94404d66b7afd36082bfb98c577a2af8d6b9f5563716297c1275ae3ca",
  "duration_ms": 221000
}