{
  "version": "1.0.0",
  "timeline_id": "dc2131fc-3d77-4a48-bfae-b39f9353e3c4",
  "source_media": {
    "id": "8ee1e609-78a0-48d2-8a59-3359c691f63a",
    "uri": "C:\\HARSHINI\\PLACEMENT\\incubrix\\test_pack\\assets\\interview.mp4",
    "duration_ms": 225000,
    "fps": 30.0,
    "width": 1280,
    "height": 720,
    "audio_channels": 1,
    "audio_sample_rate": 44100,
    "sha256": "9ff80ed37e9fffb52ad80052440952262b076088d6b03d899e62017e785af73d"
  },
  "segments": [
    {
      "id": "b0e8bdc3-bacd-4044-bd86-8d8e58d4ddf4",
      "source_id": "8ee1e609-78a0-48d2-8a59-3359c691f63a",
      "source_start_ms": 0,
      "source_end_ms": 215000,
      "speed": 1.0,
      "volume": 1.0,
      "muted": false,
      "tags": []
    }
  ],
  "captions": [],
  "audio_effects": [],
  "background_audio": [],
  "history_index": 0,
  "timeline_hash": "a8ad3b1783798f7146e486ca52288618511f14622ac9d544d61b92a84998165a",
  "duration_ms": 215000
}