{
  "version": "1.0.0",
  "timeline_id": "2cf84655-a058-4eb6-a622-95da428e6371",
  "source_media": {
    "id": "38831e96-f17c-4ceb-9a51-1a1d52f41fbb",
    "uri": "C:\\HARSHINI\\PLACEMENT\\incubrix\\test_pack\\assets\\interview.mp4",
    "duration_ms": 225000,
    "fps": 30.0,
    "width": 1280,
    "height": 720,
    "audio_channels": 1,
    "audio_sample_rate": 44100,
    "sha256": "9ff80ed37e9fffb52ad80052440952262b076088d6b03d899e62017e785af73d"
  },
  "segments": [
    {
      "id": "2af15956-b325-4e2b-a43d-0c088548e10a",
      "source_id": "38831e96-f17c-4ceb-9a51-1a1d52f41fbb",
      "source_start_ms": 0,
      "source_end_ms": 10000,
      "speed": 1.0,
      "volume": 1.0,
      "muted": false,
      "tags": []
    },
    {
      "id": "b0a25b93-dc38-426a-a905-de30d0cef354",
      "source_id": "38831e96-f17c-4ceb-9a51-1a1d52f41fbb",
      "source_start_ms": 10000,
      "source_end_ms": 30000,
      "speed": 2.0,
      "volume": 1.0,
      "muted": false,
      "tags": []
    },
    {
      "id": "42910a70-5f2d-40f5-b32a-6d7d967cbcf3",
      "source_id": "38831e96-f17c-4ceb-9a51-1a1d52f41fbb",
      "source_start_ms": 30000,
      "source_end_ms": 225000,
      "speed": 1.0,
      "volume": 1.0,
      "muted": false,
      "tags": []
    }
  ],
  "captions": [],
  "audio_effects": [],
  "background_audio": [],
  "history_index": 0,
  "timeline_hash": "3cbe5f9d65e495422fe6b9a1f03ed50f29214aee342bb54d9106f005efd7065b",
  "duration_ms": 215000
}